{
  "after": "**",
  "before": "workspace/src/**",
  "drift_class": "capability drift",
  "evidence_refs": [
    "evidence:runtime:1"
  ],
  "explanation": "Capability scope expanded.",
  "finding_id": "drift:1",
  "fingerprint": "aaaaaaaaaaaaaaaaaaaaaaaaaaaaaaaaaaaaaaaaaaaaaaaaaaaaaaaaaaaaaaaa",
  "schema_version": "1.0.0",
  "verdict": "warn"
}
